{
  "$schema": "https://json-schema.org/draft/2020-12/schema",
  "$id": "fixtures/schemas/did_highsnr_onset.json",
  "title": "ROUND-3 comparison c2_highsnr_onset_residual",
  "type": "object",
  "additionalProperties": false,
  "required": [
    "comparison_id",
    "did",
    "did_status",
    "treatment_value",
    "treatment_baseline",
    "control_value",
    "control_baseline",
    "p_raw",
    "p_bh",
    "m",
    "n_total",
    "n_match",
    "n_judgeable",
    "n_empty_realized",
    "n_dur_le_0",
    "n_total_status",
    "n_match_status",
    "n_judgeable_status",
    "n_empty_realized_status",
    "n_dur_le_0_status",
    "singing_prob_source",
    "G_h",
    "n_h_judgeable",
    "ci_unreliable",
    "conclusion"
  ],
  "properties": {
    "comparison_id": { "const": "c2_highsnr_onset_residual" },
    "did": { "type": ["number", "null"] },
    "did_status": { "type": "string" },
    "treatment_value": { "type": ["number", "null"] },
    "treatment_baseline": { "type": ["number", "null"] },
    "control_value": { "type": ["number", "null"] },
    "control_baseline": { "type": ["number", "null"] },
    "p_raw": { "type": ["number", "null"] },
    "p_bh": { "type": ["number", "null"] },
    "m": { "type": "integer", "minimum": 1 },
    "n_total": { "type": ["integer", "null"] },
    "n_match": { "type": ["integer", "null"] },
    "n_judgeable": { "type": ["integer", "null"] },
    "n_empty_realized": { "type": ["integer", "null"] },
    "n_dur_le_0": { "type": ["integer", "null"] },
    "n_total_status": { "type": "string" },
    "n_match_status": { "type": "string" },
    "n_judgeable_status": { "type": "string" },
    "n_empty_realized_status": { "type": "string" },
    "n_dur_le_0_status": { "type": "string" },
    "singing_prob_source": {
      "type": "string",
      "const": "task2_window_quality/window_quality_with_flags.csv"
    },
    "G_h": { "type": ["integer", "null"] },
    "n_h_judgeable": { "type": ["integer", "null"] },
    "ci_unreliable": { "type": "integer", "enum": [0, 1] },
    "conclusion": { "type": "string" },
    "exploratory": { "type": "integer", "enum": [0, 1] },
    "descriptive": { "type": "integer", "enum": [0, 1] }
  }
}
