{
  "G_h": 382,
  "ci_unreliable": 0,
  "comparison_id": "c2_highsnr_onset_residual",
  "conclusion": "rejects_H2",
  "control_baseline": 0.9291808873720137,
  "control_value": 0.8632478632478633,
  "did": -0.06456606643970009,
  "did_status": "ok",
  "exploratory": 0,
  "m": 3,
  "n_dur_le_0": 492,
  "n_dur_le_0_status": "ok",
  "n_empty_realized": 96,
  "n_empty_realized_status": "ok",
  "n_h_judgeable": 3364,
  "n_judgeable": 3364,
  "n_judgeable_status": "ok",
  "n_match": 2909,
  "n_match_status": "ok",
  "n_total": 3952,
  "n_total_status": "ok",
  "p_bh": 0.5881327056061719,
  "p_raw": 0.3920884704041146,
  "singing_prob_source": "task2_window_quality/window_quality_with_flags.csv",
  "treatment_baseline": 0.7492354740061162,
  "treatment_value": 0.6187363834422658
}