{
  "G_h": 3,
  "ci_unreliable": 1,
  "comparison_id": "c2_highsnr_onset_residual",
  "conclusion": "inconclusive",
  "control_baseline": 0.9629629629629629,
  "control_value": null,
  "did": null,
  "did_status": "missing",
  "exploratory": 0,
  "m": 3,
  "n_dur_le_0": 5,
  "n_dur_le_0_status": "ok",
  "n_empty_realized": 1,
  "n_empty_realized_status": "ok",
  "n_h_judgeable": 36,
  "n_judgeable": 36,
  "n_judgeable_status": "ok",
  "n_match": 34,
  "n_match_status": "ok",
  "n_total": 42,
  "n_total_status": "ok",
  "p_bh": null,
  "p_raw": null,
  "singing_prob_source": "task2_window_quality/window_quality_with_flags.csv",
  "treatment_baseline": 0.8888888888888888,
  "treatment_value": null
}